genus,href,title,caption,author
"Epitobrilus steineri (Micoletzky, 1925) Zullini, 2005",https://www.wur.nl/upload_mm/b/e/f/7bf9604b-608f-4b37-b5e8-a58b46aae6b4_Tobrilus%20steineri%20vulva%2C%20vagina.jpg,Epitobrilus steineri: vulva & vagina ,Epitobrilus steineri: vulva & vagina,
"Epitobrilus steineri (Micoletzky, 1925) Zullini, 2005",https://www.wur.nl/upload_mm/b/7/2/70f172ff-e154-4bbd-b898-cc82ab7436e1_Tobrilus%20steineri%20ged.%20staart%2C%20setae.jpg,Epitobrilus steineri: tail part with small subterminal supplements ,Epitobrilus steineri: tail part with small subterminal supplements,
"Epitobrilus steineri (Micoletzky, 1925) Zullini, 2005",https://www.wur.nl/upload_mm/5/9/8/3d9b3cb7-e290-4534-9116-816a0813e287_Tobrilus%20steineri%20afvoerbuisje%20op%20staartpunt.jpg,Epitobrilus steineri: tail tip with gland opening ,Epitobrilus steineri: tail tip with gland opening,
Epsilonema,,,,Tineke Vendrig
Epsilonema,https://www.wur.nl/upload_mm/2/3/d/96aa5f2c-0b62-498c-b92b-e1ac0e1cda00_Epsilonema%20overzicht2.jpg,Epsilonema,Epsilonema,Tineke Vendrig
Epsilonema,https://www.wur.nl/upload_mm/1/e/4/af15b759-b24d-469f-9bf4-4870d3ce7574_Epsilonema%20amphiden%201.jpg,Epsilonema: amphids,Epsilonema: amphids,Tineke Vendrig
Epsilonema,https://www.wur.nl/upload_mm/6/3/c/a1315432-aa37-460a-a96f-2b4985a822af_Epsilonema%20amphiden.jpg,Epsilonema: amphids,Epsilonema: amphids,Tineke Vendrig
Epsilonema,https://www.wur.nl/upload_mm/1/2/6/fdc02025-f47d-458b-a88b-2971a7171c88_Epsilonema%20slokdarm%2Csetae.jpg,"Epsilonema: esophagus, setae","Epsilonema: esophagus, setae",Tineke Vendrig
Epsilonema,https://www.wur.nl/upload_mm/2/4/a/2d4e09da-f731-4160-9350-4c74e28c54f7_Epsilonema%20slokdarm.jpg,Epsilonema: esophagus,Epsilonema: esophagus,Tineke Vendrig
Epsilonema,https://www.wur.nl/upload_mm/d/7/4/3ff4fe36-6721-4c9e-a9e2-88fedc607c15_Epsilonema%20setae.jpg,Epsilonema: setae,Epsilonema: setae,Tineke Vendrig
Epsilonema,https://www.wur.nl/upload_mm/2/9/9/81132f95-2f03-4dcf-bc54-ccda1de6aabb_Epsilonema%20cuticula.jpg,Epsilonema: cuticle,Epsilonema: cuticle,Tineke Vendrig
Epsilonema,https://www.wur.nl/upload_mm/e/2/a/64eef8c0-ba2d-4d5e-9851-a05af4fd5d77_Epsilonema%20tail.jpg,Epsilonema: tail,Epsilonema: tail,Tineke Vendrig
"Globodera pallida (Stone, 1973) Behrens, 1975",,,,Hanny van Megen
"Globodera pallida (Stone, 1973) Behrens, 1975",https://www.wur.nl/upload_mm/c/1/f/08b86a8a-c1dc-453e-8d5e-cb9e443caf7d_Globodera%20pallida%20overzicht2.jpg,Globodera pallida: second-stage juvenile body ,Globodera pallida: second-stage juvenile body,Hanny van Megen
"Globodera pallida (Stone, 1973) Behrens, 1975",https://www.wur.nl/upload_mm/1/3/0/5fcecdc5-91c7-484a-b6e5-9e447c0f3ab3_Globodera%20pallida%20stekelknoppen%2C%20ged.%20slokdarm.jpg,Globodera pallida: anterior body part with stylet and part of the pharynx ,Globodera pallida: anterior body part with stylet and part of the pharynx,Hanny van Megen
"Globodera pallida (Stone, 1973) Behrens, 1975",https://www.wur.nl/upload_mm/8/2/5/0592ca66-e6f1-4973-9f1f-82f0e87d2e4e_Globodera%20pallida%20stekelknoppen%20naar%20voren%20gebogen%202.jpg,Globodera pallida: stylet knobs projecting forward ,Globodera pallida: stylet knobs projecting forward,Hanny van Megen
"Globodera pallida (Stone, 1973) Behrens, 1975",https://www.wur.nl/upload_mm/d/a/3/8c938686-4245-49f1-96d6-5f5b74a33917_Globodera%20pallida%20stekelknoppen%20naar%20voren%20gebogen.jpg,Globodera pallida: stylet knobs projecting forward ,Globodera pallida: stylet knobs projecting forward,Hanny van Megen
"Globodera pallida (Stone, 1973) Behrens, 1975",https://www.wur.nl/upload_mm/d/8/b/bddad03d-a49c-4e09-ad2d-c8854e493fd8_Globodera%20pallida%20ged.%20slokdarm.jpg,Globodera pallida: posterior part of the pharynx with pharyngeal glands overlapping the intestine ,Globodera pallida: posterior part of the pharynx with pharyngeal glands overlapping the intestine,Hanny van Megen
"Globodera pallida (Stone, 1973) Behrens, 1975",https://www.wur.nl/upload_mm/c/8/b/8471c565-bf56-4d56-acbd-9f865b5d810f_Globodera%20pallida%20ged.%20zenuwring%2C%20slokdarmbasis.jpg,Globodera pallida: posterior part of the pharynx with the nerve ring partially visible  ,Globodera pallida: posterior part of the pharynx with the nerve ring partially visible,Hanny van Megen
"Globodera pallida (Stone, 1973) Behrens, 1975",https://www.wur.nl/upload_mm/c/2/6/026df5e6-b6a8-445d-90f7-67ab72e8c31a_Globodera%20pallida%20primordium%202.jpg,Globodera pallida: genital primordium,Globodera pallida: genital primordium,Hanny van Megen
"Globodera pallida (Stone, 1973) Behrens, 1975",https://www.wur.nl/upload_mm/8/d/a/a2299dfa-62a0-474f-a2f2-f894f8be7caf_Globodera%20pallida%20primordium.jpg,Globodera pallida: genital primordium,Globodera pallida: genital primordium,Hanny van Megen
"Globodera pallida (Stone, 1973) Behrens, 1975",https://www.wur.nl/upload_mm/2/6/8/854b81a7-cce4-4d4a-b048-e118171a3067_Globodera%20pallida%20anale%20opening%2C%20staartpunt.jpg,Globodera pallida: tail region with anal opening and hyaline tail part ,Globodera pallida: tail region with anal opening and hyaline tail part,Hanny van Megen
Globodera rostochiensis,,,,Hein Overmars
Globodera rostochiensis,,,,Hanny van Megen
Globodera rostochiensis,https://www.wur.nl/upload_mm/f/8/4/2ce9e31d-ff9e-406b-82d0-22c1a2805117_Globodera%20rostochiensis%20overzicht2.jpg,Globodera rostochiensis,Globodera rostochiensis,Hanny van Megen
Globodera rostochiensis,https://www.wur.nl/upload_mm/e/5/8/6ab51a1b-877c-432d-9fd2-b2a7c47fc325_Globodera%20rost.%20afvoerbuisje%20dorsale%20slokdarmklier%2C%20ged.slokdarm%20%281%29.jpg,"Globodera rostochiensis: excretory duct dorsal oesophageal gland valve, posterior part of esophagus","Globodera rostochiensis: excretory duct dorsal oesophageal gland valve, posterior part of esophagus",Hanny van Megen
Globodera rostochiensis,https://www.wur.nl/upload_mm/d/0/2/b04f67cf-5fba-4f16-8ec7-5dd38d6c511d_Globodera%20rosthiensis%20stekel%2C%20lipkap%2C%20ged.%20slokdar%202m.jpg,"Globodera rostochiensis: stylet, labial disc, posterior part of esophagus","Globodera rostochiensis: stylet, labial disc, posterior part of esophagus",Hanny van Megen
Globodera rostochiensis,https://www.wur.nl/upload_mm/d/7/6/e0a79461-5464-4636-97de-702d0a8daefb_Globodera%20rostochiensis%20middenbulbus.jpg,Globodera rostochiensis: median bulb,Globodera rostochiensis: median bulb,Hanny van Megen
Globodera rostochiensis,https://www.wur.nl/upload_mm/a/f/e/6bca390e-3e92-4b15-9e3f-a7d213882a18_Globodera%20rostochiensis%20stekel%2C%20lipkap%2C%20ged.%20slokdarm.jpg,"Globodera rostochiensis: stylet, labial disc, posterior part of esophagus","Globodera rostochiensis: stylet, labial disc, posterior part of esophagus",Hanny van Megen
Globodera rostochiensis,https://www.wur.nl/upload_mm/f/7/6/481ca022-8d92-4a2d-bc88-03709f9d7bc8_Globodera%20rostochiensis%20excretiepore%2C%20lange%20overlap.jpg,"Globodera rostochiensis: excretion pore, long overlap","Globodera rostochiensis: excretion pore, long overlap",Hanny van Megen
Globodera rostochiensis,https://www.wur.nl/upload_mm/b/c/4/fbdd0701-1ae7-47a4-85fc-a52098cf0e36_Globoera%20rostochiensis%20primordium.jpg,Globodera rostochiensis: genital primordium,Globodera rostochiensis: genital primordium,Hanny van Megen
Globodera rostochiensis,https://www.wur.nl/upload_mm/6/8/0/9eeaf5bf-a01a-45bf-a56f-139b66a10990_Globodera%20rostochiensis%20anale%20opening%2C.jpg,Globodera rostochiensis: anal opening,Globodera rostochiensis: anal opening,Hanny van Megen
Globodera rostochiensis,https://www.wur.nl/upload_mm/e/4/e/8035ba20-f699-4948-a3e1-0c02276c82b9_Globodera%20rostochiensis%20anale%20opening%2C%20staartpunt.jpg,"Globodera rostochiensis: anal opening, tail region","Globodera rostochiensis: anal opening, tail region",Hanny van Megen
"Haliplectus Cobb, 1913",,,,Hanny van Megen
"Haliplectus Cobb, 1913",https://www.wur.nl/upload_mm/b/c/4/cfb666f9-502d-4712-9239-c0381f1f894a_Haliplectus%20overzicht2.jpg,Haliplectus: female body ,Haliplectus: female body,Hanny van Megen
"Haliplectus Cobb, 1913",https://www.wur.nl/upload_mm/b/0/4/38c299d7-d726-47e4-b166-92276508fd31_Haliplectus%20overzicht.jpg,Haliplectus: male body ,Haliplectus: male body,Hanny van Megen
"Haliplectus Cobb, 1913",https://www.wur.nl/upload_mm/8/f/c/3a2f0927-f688-444b-8acc-ad46c8d5d60f_Haliplectus6%5B1%5D.jpg,Haliplectus: anterior body ,Haliplectus: anterior body,Hanny van Megen
"Haliplectus Cobb, 1913",https://www.wur.nl/upload_mm/5/4/2/f17d65da-236b-42a1-9760-3445d0e2c329_Haliplectus%20amphide.jpg,Haliplectus: small circular amphid aperature ,Haliplectus: small circular amphid aperature,Hanny van Megen
"Haliplectus Cobb, 1913",https://www.wur.nl/upload_mm/5/3/4/8bc0f968-ad00-4921-8968-119b47ee208b_Haliplectus%20dwarsgroef%20eindbulbus.jpg,"Haliplectus: buccal cavity, oval-shaped anterior bulb and large rounded basal bulb with valvular apparatus ","Haliplectus: buccal cavity, oval-shaped anterior bulb and large rounded basal bulb with valvular apparatus",Hanny van Megen
"Haliplectus Cobb, 1913",https://www.wur.nl/upload_mm/1/9/c/e2d7c8eb-c830-4569-a33c-2e8bc48465d6_Haliplectus%20mondholte%20male.jpg,Haliplectus: buccal cavity ,Haliplectus: buccal cavity,Hanny van Megen
"Haliplectus Cobb, 1913",https://www.wur.nl/upload_mm/5/9/6/fb3f166a-ee59-4041-b0f1-a29b4557dbde_haliplectus%20amphide%20male.jpg,Haliplectus: amphid aperature and strongly annulated cuticle,Haliplectus: amphid aperature and strongly annulated cuticle,Hanny van Megen
"Haliplectus Cobb, 1913",https://www.wur.nl/upload_mm/c/d/9/6bcf8f63-d5cc-4ea6-b946-30e7c5854799_Haliplectus%20overgang%20naar%20darmen.jpg,Haliplectus: basal bulb-intestine region ,Haliplectus: basal bulb-intestine region,Hanny van Megen
"Haliplectus Cobb, 1913",https://www.wur.nl/upload_mm/1/9/2/7ed910fe-5a7c-4b6e-ae86-713b96eccffc_Haliplectus%20cuticulakanaaltjes%20voor%20staartpunt.jpg,Haliplectus: row of cuticle pores at tail region,Haliplectus: row of cuticle pores at tail region,Hanny van Megen
"Haliplectus Cobb, 1913",https://www.wur.nl/upload_mm/f/3/0/f89e699d-5fd6-4475-be7f-1301007d1428_Haliplectus%20cuticulakanaaltjes.jpg,Haliplectus: cuticle pores at head region  ,Haliplectus: cuticle pores at head region,Hanny van Megen
"Haliplectus Cobb, 1913",https://www.wur.nl/upload_mm/5/4/c/9ae0b11f-f263-4565-8a7f-50502d444bc9_Haliplectus%20vulva%2C%20vagina.jpg,"Haliplectus: vulva, vagina","Haliplectus: vulva, vagina",Hanny van Megen
"Haliplectus Cobb, 1913",https://www.wur.nl/upload_mm/2/9/1/b743b5b1-b83f-4f32-adb1-45331d210577_Haliplectus%20staartpunt.jpg,Haliplectus: tail region,Haliplectus: tail region,Hanny van Megen
"Haliplectus Cobb, 1913",https://www.wur.nl/upload_mm/0/4/f/a0897f63-21ae-45d5-b65f-db912d0853ee_Haliplectus%20anale%20opening.jpg,Haliplectus: anal opening,Haliplectus: anal opening,Hanny van Megen
"Haliplectus Cobb, 1913",https://www.wur.nl/upload_mm/e/9/2/34793b58-cfee-4ca5-8a3a-aef2d7d8bd60_Haliplectus%20afvoerbuisje%2C%20staartpunt.jpg,"Haliplectus: spicules with gubernaculum, spinneret (caudal glands opening) at tail tip ","Haliplectus: spicules with gubernaculum, spinneret (caudal glands opening) at tail tip",Hanny van Megen
"Haliplectus Cobb, 1913",https://www.wur.nl/upload_mm/9/a/9/4e37041a-b02c-4a3f-8594-89ac74c0a48b_Haliplectus%20geslachtspapillen%2C%20gubernaculum.jpg,Haliplectus: four pre-cloacal supplements visible ,Haliplectus: four pre-cloacal supplements visible,Hanny van Megen
Helicotylenchus,,,,Hanny van Megen
Helicotylenchus,https://www.wur.nl/upload_mm/3/f/6/ed151a29-5f92-4134-89fe-e358d3145878_Helicotylenchus%20pseudorobustus%20overzicht.jpg,Helicotylenchus pseudorobustus: female habitus ,Helicotylenchus pseudorobustus: female habitus,Hanny van Megen
Helicotylenchus,https://www.wur.nl/upload_mm/f/e/9/c5c70770-ee6a-46df-9ee8-03262dcaf404_Helicotylenchus%20pseudorobustus%20afvoerbuisje%20dorsale%20slokdarmklier.jpg,Helicotylenchus pseudorobustus: anterior body region with stylet and dorsal pharyngeal gland orifice,Helicotylenchus pseudorobustus: anterior body region with stylet and dorsal pharyngeal gland orifice,Hanny van Megen
Helicotylenchus,https://www.wur.nl/upload_mm/e/b/6/5bc9bfe3-737b-4d02-9722-ca8386076ed3_Helicotylenchus%20pseudorobustus%20lipstreek%20bol%2C%20stekel%2C%20afvoerbuisje%20dorsale%20slokdarmklier.jpg,Helicotylenchus pseudorobustus: anterior body region with stylet and dorsal pharyngeal gland orifice,Helicotylenchus pseudorobustus: anterior body region with stylet and dorsal pharyngeal gland orifice,Hanny van Megen
Helicotylenchus,https://www.wur.nl/upload_mm/d/1/7/d2567445-547b-4165-ad88-3085b48cff3f_Helicotylenchus%20pseudorobustus%20middenbulbus%2C%20excretiepore.jpg,Helicotylenchus pseudorobustus: anterior body region with stylet and dorsal pharyngeal gland orifice with metacorpus and excretory pore ,Helicotylenchus pseudorobustus: anterior body region with stylet and dorsal pharyngeal gland orifice with metacorpus and excretory pore,Hanny van Megen
Helicotylenchus,https://www.wur.nl/upload_mm/4/3/5/705d36a2-33af-4cdd-b759-9494eb6156f0_Helicotylenchus%20pseudorobustus%20zijveld%20ter%20hoogte%20van%20stekel%20geareoleerd.jpg,Helicotylenchus pseudorobustus: lateral field near stylet areolated  ,Helicotylenchus pseudorobustus: lateral field near stylet areolated,Hanny van Megen
Helicotylenchus,https://www.wur.nl/upload_mm/e/1/d/b82f372a-6594-4ff3-a26e-244834e48156_Helicotylenchus%20pseudorobustus%20slokdarm%2C%20excretiepore.jpg,Helicotylenchus pseudorobustus: pharynx and excretory pore ,Helicotylenchus pseudorobustus: pharynx and excretory pore,Hanny van Megen
Helicotylenchus,https://www.wur.nl/upload_mm/8/1/1/34ea6dfd-da97-4658-8e98-00aecdc0df87_Helicotylenchus%20pseudorobustus%20vulva%2C%20vagina%2C%20zaadblaasje%20leeg.jpg,"Helicotylenchus pseudorobustus: vulva, vagina & empty spermatheca ","Helicotylenchus pseudorobustus: vulva, vagina & empty spermatheca",Hanny van Megen
Helicotylenchus,https://www.wur.nl/upload_mm/2/7/4/a3c43984-89ca-4b9e-997a-48c2e0f30a9d_Helicotylenchus%20pseudorobustus%20zijveld%20ter%20hoogte%20van%20middenbulbus%20ged.%20geareoleerd.jpg,Helicotylenchus pseudorobustus: lateral field near metacorpus partly areolated ,Helicotylenchus pseudorobustus: lateral field near metacorpus partly areolated,Hanny van Megen
Helicotylenchus,https://www.wur.nl/upload_mm/2/3/a/3c4f0519-475d-4aa0-a072-66b49085cef3_Helicotylenchus%20pseudorobustus%20zijveld.jpg,Helicotylenchus pseudorobustus: lateral field ,Helicotylenchus pseudorobustus: lateral field,Hanny van Megen
Helicotylenchus,https://www.wur.nl/upload_mm/8/c/4/bea1bc03-cdf4-4ae6-b106-bb6430337cdd_Helicotylenchus%20pseudorobustus%20anale%20opening.jpg,Helicotylenchus pseudorobustus: anal opening,Helicotylenchus pseudorobustus: anal opening,Hanny van Megen
Helicotylenchus,https://www.wur.nl/upload_mm/3/1/a/12418898-dc40-455b-9c83-075965579ef9_Helicotylenchus%20pseudorobustus%20fasmide%203%20ringen%20voor%20anus.jpg,Helicotylenchus pseudorobustus: phasmid 3 annuli anterior to anus ,Helicotylenchus pseudorobustus: phasmid 3 annuli anterior to anus,Hanny van Megen
Helicotylenchus,https://www.wur.nl/upload_mm/5/d/9/c7b10f81-3349-48ad-9986-add82eb0269e_Helicotylenchus%20pseudorobustus%20staartpunt%2C%20anale%20opening%202.jpg,Helicotylenchus pseudorobustus: tail region with anal opening and ventral tail projection ,Helicotylenchus pseudorobustus: tail region with anal opening and ventral tail projection,Hanny van Megen
Helicotylenchus,https://www.wur.nl/upload_mm/6/f/5/87232b3e-9c1d-4283-8276-4ff71f7bb42c_Helicotylenchus%20pseudorobustus%20staartpunt%2C%20anale%20opening.jpg,Helicotylenchus pseudorobustus: tail region with anal opening and ventral tail projection ,Helicotylenchus pseudorobustus: tail region with anal opening and ventral tail projection,Hanny van Megen
Helicotylenchus,https://www.wur.nl/upload_mm/f/a/4/82e8a2d0-c526-4f51-8ed4-6a606588ce9a_Helicotylenchus%20excallus%20overzicht%20male.jpg,Helicotylenchus exallus: male habitus,Helicotylenchus exallus: male habitus,Hanny van Megen
Helicotylenchus,https://www.wur.nl/upload_mm/e/0/7/3f419c32-b8e0-4b75-81d4-662f748472e0_Helicotylenchus%20excallus%20Image2.jpg,Helicotylenchus exallus: female habitus ,Helicotylenchus exallus: female habitus,Hanny van Megen
Helicotylenchus,https://www.wur.nl/upload_mm/1/4/5/6124fcd1-c52b-4212-a1b2-0ade7ab18096_Helicotylenchus%20excallus%20afvoerbuisje%20dorsale%20slokdarmklier.jpg,Helicotylenchus exallus: anterior body region with stylet,Helicotylenchus exallus: anterior body region with stylet,Hanny van Megen
Helicotylenchus,https://www.wur.nl/upload_mm/f/1/2/aaf7c294-684a-4208-9121-1bd0756bcefa_Helicotylenchus%20excallus%20lipringen.jpg,Helicotylenchus exallus: anterior body region with stylet,Helicotylenchus exallus: anterior body region with stylet,Hanny van Megen
Helicotylenchus,https://www.wur.nl/upload_mm/9/f/f/fc3f799a-5fa1-4cfa-8e4d-b8f8e577aee4_Helicotylenchus%20excallus%20voorste%20ged.%20slokdarm.jpg,Helicotylenchus exallus: anterior part of the pharynx ,Helicotylenchus exallus: anterior part of the pharynx,Hanny van Megen
Helicotylenchus,https://www.wur.nl/upload_mm/0/6/b/0b1108ef-9453-44c5-88c9-406c0cdebb13_Helicotylenchus%20excallus%20excretiepore%20vlak%20voor%20overgang%20darm.jpg,Helicotylenchus exallus: excretory pore near pharynx-intestine level ,Helicotylenchus exallus: excretory pore near pharynx-intestine level,Hanny van Megen
Helicotylenchus,https://www.wur.nl/upload_mm/f/b/4/510f7bda-475f-4851-ab86-448b46aeed49_Helicotylenchus%20excallus%20langste%20lob%20eindbulbus%20ventraal.jpg,Helicotylenchus exallus: pharyngeal gland overlap,Helicotylenchus exallus: pharyngeal gland overlap,Hanny van Megen
Helicotylenchus,https://www.wur.nl/upload_mm/7/1/6/ed682a0b-3677-4af4-ba79-6dd3d021358d_Helicotylenchus%20excallus%20vulva.jpg,Helicotylenchus exallus: vulva,Helicotylenchus exallus: vulva,Hanny van Megen
Helicotylenchus,https://www.wur.nl/upload_mm/a/9/b/6e6d0f81-5756-4212-83bf-0e05a3034e69_Helicotylenchus%20excallus%20fasmide%2C%20zijveld%2C%20cuticularingen.jpg,"Helicotylenchus exallus: phasmid, lateral field, cuticle annulation","Helicotylenchus exallus: phasmid, lateral field, cuticle annulation",Hanny van Megen
Helicotylenchus,https://www.wur.nl/upload_mm/0/3/2/d8a9e42c-d0ea-4cc2-aa3d-a03af7b59ab1_Helicotylenchus%20excallus%20anale%20opening%2Bstaartpunt.jpg,Helicotylenchus exallus: anal opening and tail ,Helicotylenchus exallus: anal opening and tail,Hanny van Megen
Helicotylenchus,https://www.wur.nl/upload_mm/9/b/6/5fbb6dbd-dee8-4d32-b0b6-1bc8b8e1506f_Helicotylenchus%20excallus%20bursa%2Bfasmide.jpg,Helicotylenchus exallus: bursa and phasmid,Helicotylenchus exallus: bursa and phasmid,Hanny van Megen
Helicotylenchus,https://www.wur.nl/upload_mm/c/0/3/3834bcd4-885e-408f-9578-a5515d032145_Helicotylenchus%20excallus%20gubernaculum%2Cspicula%2Cstaartpunt.jpg,"Helicotylenchus exallus: gubernaculum, spicule and tailtip ","Helicotylenchus exallus: gubernaculum, spicule and tailtip",Hanny van Megen
Helicotylenchus,https://www.wur.nl/upload_mm/4/3/4/f69527bb-736c-41d3-9784-51eac30f118e_Helicotylenchus%20canadensis%20overzicht.jpg,Helicotylenchus canadensis: female habitus ,Helicotylenchus canadensis: female habitus,Hanny van Megen
Helicotylenchus,https://www.wur.nl/upload_mm/2/b/e/2ba7b62b-0b86-4a91-bb37-a7deac19f4d9_Helicotylenchus%20canadensis%20lipstreek%20afgeplat%202.jpg,Helicotylenchus canadensis: anterior body region (with flattened anterior head) ,Helicotylenchus canadensis: anterior body region (with flattened anterior head),Hanny van Megen
Helicotylenchus,https://www.wur.nl/upload_mm/1/3/8/bb2a4bfb-bbd1-4410-b6e7-e0c16ea9a83e_Helicotylenchus%20canadensis%20lipstreek%20afgeplat.jpg,Helicotylenchus canadensis: anterior body region (with flattened anterior head) ,Helicotylenchus canadensis: anterior body region (with flattened anterior head),Hanny van Megen
Helicotylenchus,https://www.wur.nl/upload_mm/d/2/e/3ec370ee-501d-4ef5-a432-512e67a83708_Helicotylenchus%20canadensis%20stekel%2C%20ged.%20slokdarm%2C%20lipstreek%2Bringen.jpg,Helicotylenchus canadensis: anterior body region (with flattened anterior head) with anterior pharynx,Helicotylenchus canadensis: anterior body region (with flattened anterior head) with anterior pharynx,Hanny van Megen
Helicotylenchus,https://www.wur.nl/upload_mm/7/5/8/2ec177f9-dfd1-475b-980e-94a022d3307f_Helicotylenchus%20canadensis%20stekel%2C%20ged.%20slokdarm.jpg,Helicotylenchus canadensis: anterior body region (with flattened anterior head) with anterior pharynx,Helicotylenchus canadensis: anterior body region (with flattened anterior head) with anterior pharynx,Hanny van Megen
Helicotylenchus,https://www.wur.nl/upload_mm/b/d/5/b259b44a-55ea-4caa-af65-b7f0857ad12a_Helicotylenchus%20canadensis%20excretiepore%2C%20overlap%20onduidelijk.jpg,Helicotylenchus canadensis: excretory pore and small pharyngeal gland overlap ,Helicotylenchus canadensis: excretory pore and small pharyngeal gland overlap,Hanny van Megen
Helicotylenchus,https://www.wur.nl/upload_mm/3/7/b/92f63767-d415-48d8-816c-5b03e4a326f4_Helicotylenchus%20canadensis%20vulva.jpg,Helicotylenchus canadensis: vulva,Helicotylenchus canadensis: vulva,Hanny van Megen
Helicotylenchus,https://www.wur.nl/upload_mm/c/0/b/099034cd-a15c-4642-9c11-7c796609a8c2_Helicotylenchus%20canadensis%20zaadblaasje%20leeg%202.jpg,Helicotylenchus canadensis: empty spermatheca ,Helicotylenchus canadensis: empty spermatheca,Hanny van Megen
Helicotylenchus,https://www.wur.nl/upload_mm/7/9/8/686383bf-684a-4739-a509-a51ac05b99a9_Helicotylenchus%20canadensis%20zaadblaasje%20leeg.jpg,Helicotylenchus canadensis: empty spermatheca,Helicotylenchus canadensis: empty spermatheca,Hanny van Megen
Helicotylenchus,https://www.wur.nl/upload_mm/4/5/2/ae068163-a9ee-48b1-82b4-8c1d0bbb3572_Helicotylenchus%20canadensis%20fasmide.jpg,Helicotylenchus canadensis: phasmid ,Helicotylenchus canadensis: phasmid,Hanny van Megen
Helicotylenchus,https://www.wur.nl/upload_mm/e/d/b/5cfc8ab4-a2f2-4718-a955-111d3338f20a_Helicotylenchus%20canadensis%20staartpunt%20afgerond%2C%20anale%20opening%202.jpg,Helicotylenchus canadensis: tail region with anal opening ,Helicotylenchus canadensis: tail region with anal opening,Hanny van Megen
Helicotylenchus,https://www.wur.nl/upload_mm/1/8/d/bb6f4abc-d26b-4b93-98fa-bf834a6be8c6_Helicotylenchus%20vulgaris%20overzicht.jpg,Helicotylenchus vulgaris: female habitus ,Helicotylenchus vulgaris: female habitus,Hanny van Megen
Helicotylenchus,https://www.wur.nl/upload_mm/b/7/5/80ca7f32-cbdb-44df-a20c-9b0c16227d65_Helicotylenchus%20vulgaris%20lipstreek%20afgeplat%20tif.jpg,Helicotylenchus vulgaris: anterior body region with flattened lip region ,Helicotylenchus vulgaris: anterior body region with flattened lip region,Hanny van Megen
Helicotylenchus,https://www.wur.nl/upload_mm/a/e/7/a3e96a38-1e9c-4b65-92dd-1210a7a14d5b_Helicotylenchus%20vulgaris%20afvoerbuisje%20dorsale%20slokdarmklier.jpg,Helicotylenchus vulgaris: anterior body region with flattened lip region with dorsal gland orifice ,Helicotylenchus vulgaris: anterior body region with flattened lip region with dorsal gland orifice,Hanny van Megen
Helicotylenchus,https://www.wur.nl/upload_mm/8/6/0/134d55c7-b4ac-43db-8d6c-c177844080bc_Helicotylenchus%20vulgaris%20middenbulbus%20en%20overlap.jpg,Helicotylenchus vulgaris: median bulb en gland overlap ,Helicotylenchus vulgaris: median bulb en gland overlap,Hanny van Megen
Helicotylenchus,https://www.wur.nl/upload_mm/0/b/0/3af38170-ace7-4b63-9374-1bea131bad92_Helicotylenchus%20vulgaris%20cuticulariingen.jpg,Helicotylenchus vulgaris: cuticle annulation ,Helicotylenchus vulgaris: cuticle annulation,Hanny van Megen
Helicotylenchus,https://www.wur.nl/upload_mm/e/8/a/269bba51-eb5a-40b8-806d-2b5ff0af5e87_Helicotylenchus%20vulgaris%20vulva%202.jpg,Helicotylenchus vulgaris: vulva,Helicotylenchus vulgaris: vulva,Hanny van Megen
Helicotylenchus,https://www.wur.nl/upload_mm/5/1/8/ff5788f2-4310-435b-9499-0c7ff67ea5d1_Helicotylenchus%20vulgaris%20vulva%2C%20zaadblaasje%20leeg.jpg,"Helicotylenchus vulgaris: vulva, empty spermatheca","Helicotylenchus vulgaris: vulva, empty spermatheca",Hanny van Megen
Helicotylenchus,https://www.wur.nl/upload_mm/c/4/5/32eb5f20-bdda-4ba4-a02b-77ed642ae8ce_Helicotylenchus%20vulgaris%20anale%20opening%2C%20staartpunt.jpg,Helicotylenchus vulgaris: tail region with anal opening ,Helicotylenchus vulgaris: tail region with anal opening,Hanny van Megen
Hemicycliophora thienemanni,,,,Hanny van Megen
Hemicycliophora thienemanni,https://www.wur.nl/upload_mm/3/9/e/153a7999-8932-4c00-a36f-ae9ca86ae6fb_Loofia%20Thienemanni%20overzicht.jpg,Hemicycliophora thienemanni: female ,Hemicycliophora thienemanni: female,Hanny van Megen
Hemicycliophora thienemanni,https://www.wur.nl/upload_mm/2/1/e/f054e94e-d228-48cd-9e96-63889e51fa47_Loofia%20Thienemanni%20stekel%2C%20gespleten%20cuticula.jpg,Hemicycliophora thienemanni: protruding stylet,Hemicycliophora thienemanni: protruding stylet,Hanny van Megen
Hemicycliophora thienemanni,https://www.wur.nl/upload_mm/7/a/e/173bd95a-2e9d-49c3-9733-bd592444fdfd_Loofia%20thienemanni%20stekel%2C%20lipstreek%2C%20ged.%20slokdarm.jpg,Hemicycliophora thienemanni: head region and anterior part of the pharynx,Hemicycliophora thienemanni: head region and anterior part of the pharynx,Hanny van Megen
Hemicycliophora thienemanni,https://www.wur.nl/upload_mm/2/5/5/93d01e43-7f0f-4502-9505-b59dad099ed0_Loofia%20Thienemanni%20stekelknoppen%2C%20lumen%2C%20slokdarm.jpg,"Hemicycliophora thienemanni: styletknobs, metacorpus and pharyngeal glands","Hemicycliophora thienemanni: styletknobs, metacorpus and pharyngeal glands",Hanny van Megen
Hemicycliophora thienemanni,https://www.wur.nl/upload_mm/9/a/c/fcd9f2c1-9f44-4c1e-82f1-cfe49935717a_Loofia%20Thienemanni%20slokdarm.jpg,Hemicycliophora thienemanni: metacorpus and pharyngeal glands,Hemicycliophora thienemanni: metacorpus and pharyngeal glands,Hanny van Megen
