genus,href,title,caption,author
Aporcelaimellus,https://www.wur.nl/upload_mm/d/1/e/67cf7527-2aea-4045-81bc-e9148c71d849_lipstreek%2C%20speeropening.jpg,Aporcella simplex: Head region with odontostyle and odontophore,Aporcella simplex: Head region with odontostyle and odontophore,Hanny van Megen
Aporcelaimellus,https://www.wur.nl/upload_mm/f/d/5/324861fa-3afa-4cdb-9a1a-e259b512c4e2_speer%2C%20ged.%20slokdarm.jpg,Aporcella simplex: Head region with odontostyle and odontophore,Aporcella simplex: Head region with odontostyle and odontophore,Hanny van Megen
Aporcelaimellus,https://www.wur.nl/upload_mm/f/b/1/f6df0600-0c47-4238-8c40-b6a6a77430e4_speeropening%2C%20voortzetting.jpg,Aporcella simplex: Head region with odontostyle aperture and odontophore,Aporcella simplex: Head region with odontostyle aperture and odontophore,Hanny van Megen
Aporcelaimellus,https://www.wur.nl/upload_mm/e/3/3/84fba00b-b629-440a-9e19-ed4e0db43aaf_speeropening%2075%25.jpg,Aporcella simplex: Head region with odontostyle replacement,Aporcella simplex: Head region with odontostyle replacement,Hanny van Megen
Aporcelaimellus,https://www.wur.nl/upload_mm/f/9/c/71038f56-1992-4ae5-a7b1-c17c7eb95524_slokdarmbasis.jpg,Aporcella simplex: Pharynx-intestine region,Aporcella simplex: Pharynx-intestine region,Hanny van Megen
Aporcelaimellus,https://www.wur.nl/upload_mm/9/f/8/49e030bc-da64-4131-8107-b4d71180c959_vulva%2C%20vagina%2C%20ged.%20ei.jpg,Aporcella simplex: Vulva region,Aporcella simplex: Vulva region,Hanny van Megen
Aporcelaimellus,https://www.wur.nl/upload_mm/a/0/e/2103b596-e367-460b-abe6-f5bf77e5d573_anale%20opening%2C%20staartpunt%201.jpg,Aporcella simplex: Tail,Aporcella simplex: Tail,Hanny van Megen
Aporcelaimellus,https://www.wur.nl/upload_mm/f/8/1/b43d6e6b-9bb0-495a-a691-7357ec30cc0f_anale%20opening%2C%20staartpunt.jpg,Aporcella simplex: Tail,Aporcella simplex: Tail,Hanny van Megen
Aporcelaimus,,,,Hanny van Megen
Aporcelaimus,https://www.wur.nl/upload_mm/0/9/c/1e2285b4-0ca4-4d08-b014-05ce6c90de1b_Aporcelaimus%20c.f.%20regius%2010x%20overzicht%203%20vulva.jpg,Aporcelaimus: mid-body region with vulva,Aporcelaimus: mid-body region with vulva,Hanny van Megen
Aporcelaimus,https://www.wur.nl/upload_mm/7/5/c/226a623a-99e7-48f9-afd2-7122057ff09c_Aporcelaimus%20c.f.%20regius%2010x%20overzicht%205%20staart.jpg,Aporcelaimus: posterior body,Aporcelaimus: posterior body,Hanny van Megen
Aporcelaimus,https://www.wur.nl/upload_mm/c/f/0/4c385c63-2a6b-466f-a222-249d3992beff_Aporcelaimus%20c.f.%20regius%2010x%20overzicht%20slokdarm.jpg,Aporcelaimus: anterior body (pharynx region),Aporcelaimus: anterior body (pharynx region),Hanny van Megen
Aporcelaimus,https://www.wur.nl/upload_mm/8/c/c/8839d4d4-b431-4ecf-9ee7-97bf2dec88ca_Aporcelaimus%20c.f.%20regius%20100x%20papillen%20niet%20versmolten.jpg,Aporcelaimus: lip region with papillae,Aporcelaimus: lip region with papillae,Hanny van Megen
Aporcelaimus,https://www.wur.nl/upload_mm/7/a/f/9a48640f-4c55-44e5-97a2-0ab9714690b7_Aporcelaimus%20c.f.%20regius%20100x%20rectum%2Canale%20opening.jpg,Aporcelaimus: tail with rectum and anal opening,Aporcelaimus: tail with rectum and anal opening,Hanny van Megen
Aporcelaimus,https://www.wur.nl/upload_mm/7/f/6/c443a9e8-45e4-425d-b108-b6743741798d_Aporcelaimus%20c.f.%20regius%20100x%20slokdarmbasis.jpg,"Aporcelaimus: pharynx-intestine region, cardia with small disc","Aporcelaimus: pharynx-intestine region, cardia with small disc",Hanny van Megen
Aporcelaimus,https://www.wur.nl/upload_mm/8/9/8/922d5b02-dfde-4beb-ba6d-af27296fe8be_Aporcelaimus%20c.f.%20regius%20100x%20speer.jpg,Aporcelaimus: head region with short odontostylet,Aporcelaimus: head region with short odontostylet,Hanny van Megen
Aporcelaimus,https://www.wur.nl/upload_mm/e/5/2/17b6b1b6-5f3d-4f85-8ff5-044e0333c312_Aporcelaimus%20c.f.%20regius%20100x%20speeropening.jpg,Aporcelaimus: head region with odontostylet opening visible,Aporcelaimus: head region with odontostylet opening visible,Hanny van Megen
Aporcelaimus,https://www.wur.nl/upload_mm/b/c/9/0bf20755-4a93-4417-8674-d5bdb9c4e498_Aporcelaimus%20c.f.%20regius%20100x%20staart.jpg,Aporcelaimus: tail,Aporcelaimus: tail,Hanny van Megen
Aporcelaimus,https://www.wur.nl/upload_mm/1/6/2/4aa071c2-1278-434c-8ccd-457b3ef27182_Aporcelaimus%20c.f.%20regius%20100x%20vulva%20dwars.jpg,Aporcelaimus: vulva with sclerotized lips,Aporcelaimus: vulva with sclerotized lips,Hanny van Megen
"Aquatides aquaticus (Thorne, 1930) Heyns, 1968",,,,Hanny van Megen
"Aquatides aquaticus (Thorne, 1930) Heyns, 1968",https://www.wur.nl/upload_mm/9/5/b/84c87d24-0b21-4acf-89e1-7647a8f0fdc0_Nygolaimus%20aquaticus%2010x%20overzicht%20slokdarm.jpg,Aquatides aquaticus: anterior body part ,Aquatides aquaticus: anterior body part,Hanny van Megen
"Aquatides aquaticus (Thorne, 1930) Heyns, 1968",https://www.wur.nl/upload_mm/0/3/8/6d0f67f4-2491-4de0-abb6-6103e9b2b2e0_Nygolaimus%20aquaticus%2010x%20overzicht%20vulva-staart.jpg,Aquatides aquaticus: posterior body part ,Aquatides aquaticus: posterior body part,Hanny van Megen
"Aquatides aquaticus (Thorne, 1930) Heyns, 1968",https://www.wur.nl/upload_mm/a/b/3/e24961f4-0169-4e8f-ba55-e2d477983b4e_Nygolaimus%20aquaticus%20100x%20%20lipstreek.jpg,Aquatides aquaticus: head with truncated lip region  ,Aquatides aquaticus: head with truncated lip region,Hanny van Megen
"Aquatides aquaticus (Thorne, 1930) Heyns, 1968",https://www.wur.nl/upload_mm/c/8/7/09d63f7d-6795-439f-bf61-2596e6e592cd_Nygolaimus%20aquaticus%20100x%20%20tand%20mondholte%20lipstreek.jpg,Aquatides aquaticus: head with linear tooth ,Aquatides aquaticus: head with linear tooth,Hanny van Megen
"Aquatides aquaticus (Thorne, 1930) Heyns, 1968",https://www.wur.nl/upload_mm/6/c/9/8dcf0657-0f79-4e4a-97b1-61eaea39bc9a_Nygolaimus%20aquaticus%20100x%20%20tand%20mondholte.jpg,Aquatides aquaticus: head with linear tooth ,Aquatides aquaticus: head with linear tooth,Hanny van Megen
"Aquatides aquaticus (Thorne, 1930) Heyns, 1968",https://www.wur.nl/upload_mm/4/4/2/8962b25b-31b9-452e-ba05-37e21c1cb02b_Nygolaimus%20aquaticus%20100x%20amphide.jpg,Aquatides aquaticus: amphide opening ,Aquatides aquaticus: amphide opening,Hanny van Megen
"Aquatides aquaticus (Thorne, 1930) Heyns, 1968",https://www.wur.nl/upload_mm/b/5/3/f3ef1884-bcb9-4936-b5a6-de4a509e181c_Nygolaimus%20aquaticus%20100x%20overzicht%20vulva.jpg,Aquatides aquaticus: vulva (not sclerotized),Aquatides aquaticus: vulva (not sclerotized),Hanny van Megen
"Aquatides aquaticus (Thorne, 1930) Heyns, 1968",https://www.wur.nl/upload_mm/b/f/9/72340608-2340-4b06-b035-f08bf4ff55e4_Nygolaimus%20aquaticus%20100x%20slpokdarmbasis%201.jpg,Aquatides aquaticus: pharynx-intestine region ,Aquatides aquaticus: pharynx-intestine region,Hanny van Megen
"Aquatides aquaticus (Thorne, 1930) Heyns, 1968",https://www.wur.nl/upload_mm/5/5/1/a72441db-2f26-4dca-a1bc-173d18631280_Nygolaimus%20aquaticus%20100x%20anale%20openingstart.jpg,Aquatides aquaticus : tail with anal opening (ventral position),Aquatides aquaticus : tail with anal opening (ventral position),Hanny van Megen
"Aquatides aquaticus (Thorne, 1930) Heyns, 1968",https://www.wur.nl/upload_mm/9/1/8/a6f0d60b-46ca-4d99-87ff-b8c234173cb9_Nygolaimus%20aquaticus%20100x%20staart%20rugligging.jpg,Aquatides aquaticus: tail end (ventral position) with caudal pores  ,Aquatides aquaticus: tail end (ventral position) with caudal pores,Hanny van Megen
Ascolaimus elongatus,,,,Hanny van Megen
Ascolaimus elongatus,https://www.wur.nl/upload_mm/3/b/8/307f48ca-2eb6-497e-a3ea-0c34c63c506c_overvirew%20eusophagus.jpg,Ascolaimus elongatus: female anterior body ,Ascolaimus elongatus: female anterior body,Hanny van Megen
Ascolaimus elongatus,https://www.wur.nl/upload_mm/4/c/7/a1e8f73e-f2ec-4a45-9360-faebc98884bd_overvirew%20middel.jpg,Ascolaimus elongatus: female mid-body ,Ascolaimus elongatus: female mid-body,Hanny van Megen
Ascolaimus elongatus,https://www.wur.nl/upload_mm/c/b/9/2718e35a-5482-4cb6-9707-5c5843eb4984_overvirew.jpg,Ascolaimus elongatus: female posterior body ,Ascolaimus elongatus: female posterior body,Hanny van Megen
Ascolaimus elongatus,https://www.wur.nl/upload_mm/8/e/3/9e0679d3-2579-43f8-8921-fea5e1b4510c_amphide%20setae1.jpg,Ascolaimus elongatus: head region with cephalic setae and amphid ,Ascolaimus elongatus: head region with cephalic setae and amphid,Hanny van Megen
Ascolaimus elongatus,https://www.wur.nl/upload_mm/6/5/e/e95a3383-169c-485d-855f-6e0a077b14d5_amphiden%202tif.jpg,Ascolaimus elongatus: head reagion with amphid in detail ,Ascolaimus elongatus: head reagion with amphid in detail,Hanny van Megen
Ascolaimus elongatus,https://www.wur.nl/upload_mm/6/3/5/3ea2b795-4428-45d4-880c-0ec49be7707c_grote%20tand.jpg,Ascolaimus elongatus: head region with weakly sclerotized buccal cavity ,Ascolaimus elongatus: head region with weakly sclerotized buccal cavity,Hanny van Megen
Ascolaimus elongatus,https://www.wur.nl/upload_mm/e/e/3/37003077-19ca-4a9c-baa2-4aff2063fe44_mondholte1.jpg,Ascolaimus elongatus: head regaion with weakly sclerotized buccal cavity ,Ascolaimus elongatus: head regaion with weakly sclerotized buccal cavity,Hanny van Megen
Ascolaimus elongatus,https://www.wur.nl/upload_mm/3/a/5/6698a7b1-f358-4839-8b35-dc86098fe2ac_setae%2Camphiden.jpg,"Ascolaimus elongatus: head region with cephalic setae, amphid and somatic setae ","Ascolaimus elongatus: head region with cephalic setae, amphid and somatic setae",Hanny van Megen
Ascolaimus elongatus,https://www.wur.nl/upload_mm/a/4/8/8648602e-b685-42f0-9adf-e94c07257124_slokdarmbasis%20%282%29.jpg,Ascolaimus elongatus: pharynx-intestine region ,Ascolaimus elongatus: pharynx-intestine region,Hanny van Megen
Ascolaimus elongatus,https://www.wur.nl/upload_mm/2/f/0/f716a7a8-0fc5-4563-be4b-58571fbde1d8_anale%20opening%2Cstaartklieren1.jpg,Ascolaimus elongatus: anale opening and posterior part of three rectal glands ,Ascolaimus elongatus: anale opening and posterior part of three rectal glands,Hanny van Megen
Ascolaimus elongatus,https://www.wur.nl/upload_mm/3/7/2/07fcd274-f9ff-4f8d-b540-1b4ab8855e38_gubernaculum.jpg,Ascolaimus elongatus: spiculus and gubernaculum (focus on gubernaculum),Ascolaimus elongatus: spiculus and gubernaculum (focus on gubernaculum),Hanny van Megen
Ascolaimus elongatus,https://www.wur.nl/upload_mm/5/3/e/ee14cd1f-382b-4728-838d-b6d303a25b1f_spicula%202.jpg,Ascolaimus elongatus: spiculus and gubernaculum (focus on spiculus tip) ,Ascolaimus elongatus: spiculus and gubernaculum (focus on spiculus tip),Hanny van Megen
Ascolaimus elongatus,https://www.wur.nl/upload_mm/5/c/1/12646f9d-762e-4af7-9c2f-f585ea7cc943_spicula%204.jpg,Ascolaimus elongatus: spiculus and gubernaculum (focus on spade-shaped proximal cephalisation) ,Ascolaimus elongatus: spiculus and gubernaculum (focus on spade-shaped proximal cephalisation),Hanny van Megen
Ascolaimus elongatus,https://www.wur.nl/upload_mm/a/9/9/a9418a09-0e4d-4bd3-897f-5e0621d03279_vulva.jpg,Ascolaimus elongatus: vulva ,Ascolaimus elongatus: vulva,Hanny van Megen
Ascolaimus elongatus,https://www.wur.nl/upload_mm/1/1/2/2f18e309-bb09-4b90-a137-230a4fac1de2_spinneret1.jpg,Ascolaimus elongatus: posterior tail part with spinneret ,Ascolaimus elongatus: posterior tail part with spinneret,Hanny van Megen
Aulolaimoides,,,,Hanny van Megen
Aulolaimoides,https://www.wur.nl/upload_mm/9/9/c/80268435-6619-473b-81ba-0d00163008ba_aulolaimoides%20overzicht.jpg,Aulolaimoides: female body,Aulolaimoides: female body,Hanny van Megen
Aulolaimoides,https://www.wur.nl/upload_mm/3/5/1/38e038dd-c120-49ca-b369-695764c53d91_aulolaimoides%20amphiden%2C%20speer%2C%20voortzetting.jpg,"Aulolaimoides: anterior body with amphid openings, odontostyle and odontophore ","Aulolaimoides: anterior body with amphid openings, odontostyle and odontophore",Hanny van Megen
Aulolaimoides,https://www.wur.nl/upload_mm/7/4/a/9949088f-fefd-478f-9030-f14f5389be7e_aulolaimoides%20geleidering%20boven%20in%20lipkap%202.jpg,Aulolaimoides: anterior body with guiding ring near lipregion ,Aulolaimoides: anterior body with guiding ring near lipregion,Hanny van Megen
Aulolaimoides,https://www.wur.nl/upload_mm/6/9/f/41a23ee6-1097-4b3d-9635-6ff1e5304d3e_aulolaimoides%20slokdarmbasis%2C%20bulbusachtig%20opgezwollen.jpg,Aulolaimoides: posterior pharyngeal part with nearly rounded basal swelling ,Aulolaimoides: posterior pharyngeal part with nearly rounded basal swelling,Hanny van Megen
Aulolaimoides,https://www.wur.nl/upload_mm/8/3/a/4dd9c807-2097-49a8-a0dd-dafd922ca65b_aulolaimoides%20vulva%2C%20slokdarmbasis.jpg,Aulolaimoides: posterior pharygeal part and vulva region ,Aulolaimoides: posterior pharygeal part and vulva region,Hanny van Megen
Aulolaimoides,https://www.wur.nl/upload_mm/b/b/5/fd0daf6c-e242-473a-9021-f1894f304004_aulolaimoides%20vulva.jpg,Aulolaimoides: vulva (V about 30%),Aulolaimoides: vulva (V about 30%),Hanny van Megen
Aulolaimoides,https://www.wur.nl/upload_mm/7/1/f/74a5ee07-47ae-4c8b-b9ef-1b96719db6fc_aulolaimoides%20anale%20opening%202.jpg,Aulolaimoides: anal opening ,Aulolaimoides: anal opening,Hanny van Megen
Aulolaimoides,https://www.wur.nl/upload_mm/d/1/9/c0dcfc0a-ed10-454d-bf90-ce7b5869ef80_aulolaimoides%20staart%2C%20lang%20en%20dun%20uitgetrokken.jpg,Aulolaimoides: tail,Aulolaimoides: tail,Hanny van Megen
Aulolaimoides,https://www.wur.nl/upload_mm/1/c/7/7b31b567-1404-4457-9a51-b1726943cd0b_aulolaimoides%20staart.jpg,Aulolaimoides: mid-tail ,Aulolaimoides: mid-tail,Hanny van Megen
Aulolaimoides,https://www.wur.nl/upload_mm/c/f/a/f2f5e1dc-0f7d-4f5f-b69b-4b36601c215d_aulolaimoides%20staartpunt%20met%20vuiltjes.jpg,Aulolaimoides: tail tip ,Aulolaimoides: tail tip,Hanny van Megen
"Aulolaimus oxycephalus de Man, 1880",,,,Hanny van Megen
"Aulolaimus oxycephalus de Man, 1880",https://www.wur.nl/upload_mm/b/1/c/9308135d-e2fd-42e4-808c-b1736c758b2f_aulolaimus%20oxycephalus%20overzicht.jpg,Aulolaimus oxycephalus: female body ,Aulolaimus oxycephalus: female body,Hanny van Megen
"Aulolaimus oxycephalus de Man, 1880",https://www.wur.nl/upload_mm/e/b/1/d67581f5-46b4-4807-b122-c6dbb6b50c5c_aulolaimus%20oxycephalus%20amphide%2Bmondholte.jpg,Aulolaimus oxycephalus: head region ,Aulolaimus oxycephalus: head region,Hanny van Megen
"Aulolaimus oxycephalus de Man, 1880",https://www.wur.nl/upload_mm/f/a/e/60da9eff-821e-4c4b-950b-7647f0631b7f_aulolaimus%20oxycephalus%20kop%2Bged.%20slokdarm%20.jpg,Aulolaimus oxycephalus: anterior body region ,Aulolaimus oxycephalus: anterior body region,Hanny van Megen
"Aulolaimus oxycephalus de Man, 1880",https://www.wur.nl/upload_mm/1/1/e/5dbeb619-beaa-48e1-859f-d0315f5920c7_aulolaimus%20oxycephalus%20mondholte.jpg,Aulolaimus oxycephalus: anterior body region ,Aulolaimus oxycephalus: anterior body region,Hanny van Megen
"Aulolaimus oxycephalus de Man, 1880",https://www.wur.nl/upload_mm/9/4/d/dc85fde7-de3e-48b8-ba8e-dd41275cfb4c_aulolaimus%20oxycephalus%20vioolvormige%20slokdarm.jpg,"Aulolaimus oxycephalus: pharynx, posterior part ","Aulolaimus oxycephalus: pharynx, posterior part",Hanny van Megen
"Aulolaimus oxycephalus de Man, 1880",https://www.wur.nl/upload_mm/a/3/a/64d9f0db-af40-4da2-bc57-4852dae87a44_auloloimus%20oxycephalus%20vioolvormige%20slokdarm%20exempl.%202.jpg,"Auloloimus oxycephalus: pharynx, posterior part","Auloloimus oxycephalus: pharynx, posterior part",Hanny van Megen
"Aulolaimus oxycephalus de Man, 1880",https://www.wur.nl/upload_mm/3/b/a/d942af48-e22e-4854-8a44-2e19387ff8b6_aulolaimus%20oxycephalus%20lengterichels%2Bcuticula%20kanaaltjes.jpg,Aulolaimus oxycephalus: cuticle with longitudinal striae ,Aulolaimus oxycephalus: cuticle with longitudinal striae,Hanny van Megen
"Aulolaimus oxycephalus de Man, 1880",https://www.wur.nl/upload_mm/e/a/d/5770d532-c237-4c1e-8ae0-5d31425d7e46_aulolaimus%20oxycephalus%20vulva%20exempl.%202.jpg,Aulolaimus oxycephalus: vulva region ,Aulolaimus oxycephalus: vulva region,Hanny van Megen
"Aulolaimus oxycephalus de Man, 1880",https://www.wur.nl/upload_mm/5/5/c/827325c9-94eb-4db0-a53e-9b448a4ade15_aulolaimus%20oxycephalus%20vulva.jpg,Aulolaimus oxycephalus: vagina with lateral flanges,Aulolaimus oxycephalus: vagina with lateral flanges,Hanny van Megen
"Aulolaimus oxycephalus de Man, 1880",https://www.wur.nl/upload_mm/e/e/0/98df452b-6624-40c7-b09b-9570743e5ef1_aulolaimus%20oxycephalus%20anale%20opening%20.jpg,Aulolaimus oxycephalus: anal opening ,Aulolaimus oxycephalus: anal opening,Hanny van Megen
Axonolaimus,,,,Hanny van Megen
Axonolaimus,https://www.wur.nl/upload_mm/f/5/0/077a365a-ac0e-425b-9113-7074e641ce2b_overzicht%20slokdarm.jpg,Axonolaimus: anterior body part,Axonolaimus: anterior body part,Hanny van Megen
Axonolaimus,https://www.wur.nl/upload_mm/e/7/0/8c8e4011-0c74-4431-91a6-85278dbf22d9_overzicht%20slokdarm%20%282%29.jpg,Axonolaimus: anterior body part ,Axonolaimus: anterior body part,Hanny van Megen
Axonolaimus,https://www.wur.nl/upload_mm/8/0/e/f277c9cc-df10-4475-aac0-3f113e491c42_overzicht%20staart%20%282%29.jpg,Axonolaimus: posterior body part,Axonolaimus: posterior body part,Hanny van Megen
Axonolaimus,https://www.wur.nl/upload_mm/c/2/f/e9736ee0-ca78-48d7-8ffd-7d5c880f9de6_overzicht%20staart.jpg,Axonolaimus: posterior body part ,Axonolaimus: posterior body part,Hanny van Megen
Axonolaimus,https://www.wur.nl/upload_mm/8/a/a/303af082-09c3-46a5-b64c-ffd1c69da4a4_amphiden%202tif.jpg,Axonolaimus: head region with amphid ,Axonolaimus: head region with amphid,Hanny van Megen
Axonolaimus,https://www.wur.nl/upload_mm/0/8/7/907c5b81-4e04-4a34-b03e-d8523a430f8e_amphiden.jpg,Axonolaimus: head region with amphid ,Axonolaimus: head region with amphid,Hanny van Megen
Axonolaimus,https://www.wur.nl/upload_mm/1/6/0/0c572ba0-fcc2-402f-a318-cc462896bbfc_mondholte%202.jpg,Axonolaimus: head region with buccal cavity and setae ,Axonolaimus: head region with buccal cavity and setae,Hanny van Megen
Axonolaimus,https://www.wur.nl/upload_mm/c/3/b/7d3110b5-7636-403c-b3f6-e40a5eb83e15_mondholte.jpg,Axonolaimus: head region with buccal cavity and setae,Axonolaimus: head region with buccal cavity and setae,Hanny van Megen
Axonolaimus,https://www.wur.nl/upload_mm/0/d/a/2f74869e-2f2a-4291-8bd0-17649b34d39d_slokdarmbasis.jpg,Axonolaimus: posterior pharynx part ,Axonolaimus: posterior pharynx part,Hanny van Megen
Axonolaimus,https://www.wur.nl/upload_mm/c/f/a/3f4b9304-ad56-4d87-a4cb-c5754079cb25_suplementen.jpg,Axonolaimus: male cloacal anterior region with a row of ventral supplements ,Axonolaimus: male cloacal anterior region with a row of ventral supplements,Hanny van Megen
Axonolaimus,https://www.wur.nl/upload_mm/b/d/b/f63d9b2a-0ff0-4976-a211-e5f3d93beefc_gubernaculum.jpg,Axonolaimus: spiculum and gubernaculum with apophyses,Axonolaimus: spiculum and gubernaculum with apophyses,Hanny van Megen
Axonolaimus,https://www.wur.nl/upload_mm/1/f/1/072020e2-e5b9-4ffc-9f7b-89fcc67f850c_gubernaculum1.jpg,Axonolaimus: spiculum and gubernaculum with apophyses ,Axonolaimus: spiculum and gubernaculum with apophyses,Hanny van Megen
Axonolaimus,https://www.wur.nl/upload_mm/b/4/f/28c2ba60-58ec-40ea-96c8-ab785202c394_spicula.jpg,Axonolaimus: spiculum and gubernaculum with apophyses ,Axonolaimus: spiculum and gubernaculum with apophyses,Hanny van Megen
Axonolaimus,https://www.wur.nl/upload_mm/1/e/9/1ab17ceb-2b0a-4d6d-a19b-1789ab009828_setae.jpg,Axonolaimus: small tail setae posterior to cloaca ,Axonolaimus: small tail setae posterior to cloaca,Hanny van Megen
Axonolaimus,https://www.wur.nl/upload_mm/b/4/4/4bd1540c-88f4-4dc8-83c9-4e6bc62c3fd7_staart%202.jpg,Axonolaimus: tail part,Axonolaimus: tail part,Hanny van Megen
Axonolaimus,https://www.wur.nl/upload_mm/a/c/6/28abf73b-7fa2-4826-8f7d-c3e0eeb5f583_staart.jpg,Axonolaimus: tail tip with spinneret ,Axonolaimus: tail tip with spinneret,Hanny van Megen
Basiria,,,,Hanny van Megen
Basiria,https://www.wur.nl/upload_mm/d/0/c/89dcb715-504a-4ed2-ba19-751118334649_BL1.jpg,Basiria aberrans: female body,Basiria aberrans: female body,Hanny van Megen
Basiria,https://www.wur.nl/upload_mm/3/e/6/465f1ae2-baac-413b-9163-6bd2ca3f9663_DGO1jpg.jpg,"Basiria aberrans: Head region with slightly curved stylet, very small knobs and short DGO","Basiria aberrans: Head region with slightly curved stylet, very small knobs and short DGO",Hanny van Megen
Basiria,https://www.wur.nl/upload_mm/1/e/e/15711d84-35aa-4721-b98b-8fc3c98f3543_deirid1.jpg,Basiria aberrans: lateral field with deirid (small pore) at excretory level,Basiria aberrans: lateral field with deirid (small pore) at excretory level,Hanny van Megen
Basiria,https://www.wur.nl/upload_mm/d/c/e/65aa9b01-e7cb-44d2-9a75-1e03e1494ef5_MB-BB1.jpg,Basiria aberrans: small metacorpus and basal bulb,Basiria aberrans: small metacorpus and basal bulb,Hanny van Megen
Basiria,https://www.wur.nl/upload_mm/1/9/8/6cef5ebc-ed3f-41bc-a682-f1c415ee9187_Vulva1.jpg,Basiaria aberrans: vulva region with short post-uterine sac,Basiaria aberrans: vulva region with short post-uterine sac,Hanny van Megen
Basiria,https://www.wur.nl/upload_mm/9/d/5/9cf00efa-8226-4c09-8374-83e89f8ef7ac_LF1.jpg,"Basiria aberrans: vulva region (ventral view) with spermatheca, tricolumella and vulva slit","Basiria aberrans: vulva region (ventral view) with spermatheca, tricolumella and vulva slit",Hanny van Megen
Basiria,https://www.wur.nl/upload_mm/8/3/2/a12c33d1-052e-464e-a392-26d4176c8858_LF%20at%20vulva1.jpg,Basiria aberrans: lateral field at mid-body,Basiria aberrans: lateral field at mid-body,Hanny van Megen
Basiria,https://www.wur.nl/upload_mm/5/d/b/d6a25a76-a11e-4d90-8227-b6f642c99614_vulva1.jpg,Basiria aberrans: vulva region (lateral view),Basiria aberrans: vulva region (lateral view),Hanny van Megen
Basiria,https://www.wur.nl/upload_mm/8/c/7/09a72474-3c8a-45ef-a6a4-acad89fb6d33_tail%20end1.jpg,Basiria aberrans: tail end,Basiria aberrans: tail end,Hanny van Megen
Basiria,https://www.wur.nl/upload_mm/b/b/1/7e1dfca6-1099-4977-9060-61d8069f8761_V-tail%20end1.jpg,Basiria aberrans: posterior body part,Basiria aberrans: posterior body part,Hanny van Megen
Basiria,https://www.wur.nl/upload_mm/7/1/8/a390166b-7ed8-4605-a839-1f21ec885215_anus1.jpg,Basiria aberrans: body at anus level,Basiria aberrans: body at anus level,Hanny van Megen
Basiria,https://www.wur.nl/upload_mm/b/8/7/56a032f3-f76e-4072-a18a-ac0b0113e4b5_amphid1.jpg,Basiria aberrans: head region with amphid opening. ,Basiria aberrans: head region with amphid opening.,Hanny van Megen
Basiria,https://www.wur.nl/upload_mm/f/c/d/ce221b56-dc1c-4e16-ab60-3cb0f2748d70_SE-pore1.jpg,Basiria aberrans: anterior body with SE-pore and basal bulb,Basiria aberrans: anterior body with SE-pore and basal bulb,Hanny van Megen
Basiria,https://www.wur.nl/upload_mm/3/9/7/7cc4a74f-380b-4d7e-8fe1-6876b3850122_V-tail%20end1.jpg,Basiria aberrans: posterior body part,Basiria aberrans: posterior body part,Hanny van Megen
"Bastiania de Man, 1876",,,,Hanny van Megen
"Bastiania de Man, 1876",https://www.wur.nl/upload_mm/c/e/c/4f15abc0-9aaf-43e1-b55e-3ddd9b09e505_bastiania.jpg,Bastiania: anterior body,Bastiania: anterior body,Hanny van Megen
"Bastiania de Man, 1876",https://www.wur.nl/upload_mm/9/6/6/2b29af45-d7fa-4063-bc8f-a3891d4d70f6_Bastiania%20gracilis%2005-12-00.jpg,Bastiania: posterior body,Bastiania: posterior body,Hanny van Megen
"Bastiania de Man, 1876",https://www.wur.nl/upload_mm/c/4/f/256c6be9-5132-4905-951d-564fa6a4efb1_bastiania%20amphide.jpg,Bastiania: head region with setae and spiroid shaped amphid,Bastiania: head region with setae and spiroid shaped amphid,Hanny van Megen
"Bastiania de Man, 1876",https://www.wur.nl/upload_mm/d/2/8/55f99b27-9b73-462e-bafc-b9f304af6906_bastiania%20amphide2.jpg,Bastiania: head region with setae and spiroid shaped amphid,Bastiania: head region with setae and spiroid shaped amphid,Hanny van Megen
"Bastiania de Man, 1876",https://www.wur.nl/upload_mm/a/6/e/01718863-96cf-4adb-89d9-32fd565b3a04_bastiania%20setae.jpg,Bastiania: heat region with setae,Bastiania: heat region with setae,Hanny van Megen
"Bastiania de Man, 1876",https://www.wur.nl/upload_mm/6/f/d/d4688615-d3cf-4a9d-a010-07d57003c99e_bastiania%20vulva.jpg,Bastiania: vulva,Bastiania: vulva,Hanny van Megen
"Bastiania de Man, 1876",https://www.wur.nl/upload_mm/8/e/d/84804f19-37eb-4c74-9d79-e7021419712e_bastiania%20vulva%20ged.gonade.jpg,Bastiania: mid-body with vulva and part of gonads,Bastiania: mid-body with vulva and part of gonads,Hanny van Megen
"Bastiania de Man, 1876",https://www.wur.nl/upload_mm/2/0/6/25275aa6-23b9-46b9-a40b-d201bae0f896_bastiania%20anale%20opening.jpg,Bastiania: tail region with anal opening,Bastiania: tail region with anal opening,Hanny van Megen
"Bathylaimus Cobb, 1894",,,,Hanny van Megen
"Bathylaimus Cobb, 1894",https://www.wur.nl/upload_mm/b/a/9/71fa82b7-3a42-4bc4-abb9-2f3b20724495_overzicht%20slokdarm.jpg,Bathylaimus: anterior body part,Bathylaimus: anterior body part,Hanny van Megen
"Bathylaimus Cobb, 1894",https://www.wur.nl/upload_mm/0/a/2/4e41f996-cee6-47f0-9288-4d2bb761a75c_overzicht%20staart.jpg,Bathylaimus: posterior body part,Bathylaimus: posterior body part,Hanny van Megen
"Bathylaimus Cobb, 1894",https://www.wur.nl/upload_mm/2/4/4/b992f2af-0782-4dc9-a47a-ac23a722d9b4_mondholte%2Cged.%20slokdarm%20ex.%202.jpg,Bathylaimus: head region with setae and large buccal cavity,Bathylaimus: head region with setae and large buccal cavity,Hanny van Megen
"Bathylaimus Cobb, 1894",https://www.wur.nl/upload_mm/a/4/c/269c5bcd-845a-40a9-a704-9ee0d895d29a_mondholte%2Cged.%20slokdarm.jpg,Bathylaimus: head region with setae and large buccal cavity,Bathylaimus: head region with setae and large buccal cavity,Hanny van Megen
"Bathylaimus Cobb, 1894",https://www.wur.nl/upload_mm/9/5/c/186c0f2a-29a2-4f5a-82cc-b632c5ef1e79_mondholte%2Csetae.jpg,Bathylaimus: head region with setae and large buccal cavity,Bathylaimus: head region with setae and large buccal cavity,Hanny van Megen
